{
  "$schema": "https://json-schema.org/draft/2020-12/schema",
  "$id": "events/ops-core/recall/recall-case-opened.v1.json",
  "title": "Recall Case Opened Event v1",
  "description": "Published when a recall case is opened from trace evidence. Recall uses trace chain and does not create an independent truth chain.",
  "$comment": "Sources: PACK-01 Recall/Traceability.",
  "type": "object",
  "additionalProperties": false,
  "properties": {
    "eventId": {
      "type": "string",
      "minLength": 1,
      "description": "Unique event identifier."
    },
    "eventType": {
      "type": "string",
      "const": "ops-core.recall.recall-case-opened.v1",
      "description": "Stable event type including source, domain, name, and v1 suffix."
    },
    "eventVersion": {
      "type": "string",
      "const": "1.0",
      "description": "Event contract version."
    },
    "occurredAt": {
      "type": "string",
      "format": "date-time",
      "description": "Time the domain event occurred."
    },
    "source": {
      "type": "string",
      "const": "ops-core",
      "description": "System that owns and emits this event."
    },
    "correlationId": {
      "type": "string",
      "minLength": 1,
      "description": "Cross-system correlation identifier."
    },
    "causationId": {
      "type": "string",
      "minLength": 1,
      "description": "Optional parent command, event, or workflow identifier."
    },
    "idempotencyKey": {
      "type": "string",
      "minLength": 1,
      "description": "Required when emitted from retryable or high-risk command; optional for derived read-model notifications."
    },
    "data": {
      "allOf": [
        {
          "$ref": "../../../schemas/ops/recall-case.schema.json"
        },
        {
          "type": "object",
          "required": [
            "recall_case_id",
            "status"
          ],
          "properties": {
            "status": {
              "const": "OPEN"
            }
          }
        }
      ]
    }
  },
  "required": [
    "eventId",
    "eventType",
    "eventVersion",
    "occurredAt",
    "source",
    "correlationId",
    "data"
  ]
}
